key;account;raèun
922;Treasury shares and stakes;Vlastite dionice i udjeli (odbitna- dugovna stavka)
923;Statutory reserves;Statutarne prièuve
924;Other reserves;Ostale prièuve
93;REVALUATION RESERVES AND FER VALUE RESERVES ;REVALORIZACIJSKE PRIÈUVE I PRIÈUVE FER VRIJEDNOSTI
930;Revaluation reserves from tangible and intangible assets;Revalorizacijske prièuve s osnove revalorizacije dugotrajne materijalne i nematerijalne imovine
931;Fer value revaluation reserves  ;Prièuve fer vrijednosti
932;Foreign currency from foreign translation;Teèajne razlike iz preraèuna inozemnog poslovanja
933;Other accumulated comprehensive income / loss;Udio u ostaloj sveobuhvatnoj dobiti/gubitku društava povezanih sudjelujuæim interesom
934;Actuarial gains/losess based on employment benefits;Aktuarski dobici/gubici po planovima definiranih primanja
935;Other changes in capital (minorities) ;Ostale nevlasnièke promjene kapitala
94;RETAINED EARNINGS OR ACCUMULATED LOSS;ZADRŽANI DOBITAK ILI PRENESENI GUBITAK
940;Retained earnings;Zadržani dobitak (iz prethodnih godina)
941;Accumulated loss;Preneseni gubitak (kumuliran u prethodnim godinama - analitika po èlanovima)
95;PROFIT OR LOSS FOR THE YEAR;DOBITAK ILI GUBITAK POSLOVNE GODINE
950;Profit or loss for the year;Dobitak poslovne godine
951;Loss for the year;Gubitak poslovne godine (analitika po èlanovima)
96;NON-CONTROLLING INTERESTS;MANJINSKI INTERES
960;Non-controlling interests;Manjinski interes
99;OFF- BALANCE SHEET BALANCE;IZVANBILANÈNI ZAPISI
990;Property plant and equipment in use;Imovina - materijalna u optjecaju
991;Rights and receivables to be used;Prava i tražbine
992;Securities;Vrijednosni papiri
993;Securities in circulation;Vrijednosnice u manipulaciji
994;Calculation of profit from investment in securities;Obraèun dobitka investicijskog pothvata
995;Source of property plant and equipment;Izvori materijalne imovine
996;Source of rights and obligarions;Izvori prava i obveze
997;Liabilities for securities which are not in circulation;Obveze za vrijednosne papire koji nisu stavljeni u optjecaj
998;Liabilities for securities in circulation;Obveze za izdane vrijednosnice u manipulaciji
999;Liabilities due to investment project;Obveze s osnove investicijskog pothvata
