key;account;raèun
431;Depreciation of property, plant and equipment;Amortizacija materijalne imovine
432;Depreciation of cars and other vehicles for personal transportation;Amortizacija osobnih automobila i dr. sredstava za osobni prijevoz
433;Depreciation of property, plant and - management and selling department;Amortizacija objekata i opreme uprave i prodaje
434;Depreciation surplus due to revaluation of assets;Poveæana amortizacija s temelja revalorizacije
435;Depreciation of biological assets (vineyards, orchards, live stock);Amortizacija biološke imovine (vinogradi, voænjaci, osnovno stado i sl.)
436;Tax not-deductable depreciation;Amortizacija iznad porezno dopuštene
44;VALUE ADJUSTMENT OF NON-CURRENT AND CURRENT ASSETS;VRIJEDNOSNO USKLAÐENJE DUGOTRAJNE I KRATKOTRAJNE IMOVINE
440;Value adjustment of non-current intangible assets (acc. 018);Vrijednosno usklaðenje dugotrajne nematerijalne imovine (018)
441;Value adjustment of property, plant and equipment;Vrijednosno usklaðenje dugotrajne materijalne imovine
442;Value adjustment of non-current receivables (acc. 078);Vrijednosno usklaðenje dugotrajnih potraživanja (veza sa 078)
444;Value adjustment of deposit on banks, bills of exchange, cheques (acc. 109 and acc. 119);Vrijednosno usklaðenje depozita u bankama, mjenica, èekova i sl. (109 i dio 119)
445;Value adjustment of current receivables;Vrijednosno usklaðenje kratkotrajnih potraživanja
446;Value adjustment of inventory;Vrijednosno usklaðenje zaliha (veza s 319, 329, 359 i 369)
447;Value adjustment of advance payments;Vrijednosno usklaðenje danih predujmova (veza s 379)
448;Value adjustment of receivables from bankruptcy;Vrijednosno usklaðenje potraživanja iz predsteèajne nagodbe
449;Inventory writte off;Otpis zaliha materijala
45;PROVISIONS;REZERVIRANJA (v. skupinu 28)
450;Long-term provision for pensions, severance payments and other employment benefits;Troškovi dugoroènog rezerviranja za mirovine, otpremnine i sl. obveze (èl. 11. st. 2. ZoPD-a)
451;Long-term provision for tax obligations;Rezerviranja za porezne obveze
452;Long term provision for litigation losses;Troškovi dugoroènog rezerviranja za gubitke po zapoèetim sudskim sporovima (èl. 11. st. 2. ZoPD-a)
453;Long-term provision for renewal of natural resources;Troškovi dugoroènog rezerviranja za obnovu prirodnog bogatstva (èl. 11. st. 2. ZoPD-a)
454;The cost of long term provision for risks within warranty period;Troškovi dugoroènog rezerviranja za rizike u jamstvenom (garancijskom) roku (èl. 11. st. 2. ZoPD-a)
455;The costs of long-term provision for Company's restructuring;Troškovi dugoroènog rezerviranja za restrukturiranje poduzeæa (MRS 37, t. 72. i HSFI t. 16.22)
456;The costs of provision for onerous contracts;Troškovi rezerviranja po štetnim ugovorima (HSFI 16.21.)
457;The costs of other provision for other risk and charges;Troškovi ostalih dugoroènih rezerviranja i troškovi rizika
46;OTHER OPERATING COSTS;OSTALI TROŠKOVI POSLOVANJA
460;Daily allowances for business trips and other travel expenses;Dnevnice za službena putovanja i putni troškovi
461;Cost reimbursements, allowances and scholarships;Nadoknade troškova, darovi i potpore
462;Severance payments, gifts, performance awards, grants, insurance premiums and jubilee awards;Troškovi èlanova uprave
463;Cost of internal representation and promotion;Troškovi reprezentacije i promidžbe (interne)
464;Insurance premiums;Premije osiguranja
465;Bank charges and costs of payment operations;Bankovne usluge i troškovi platnog prometa
466;Fees, compensations and other expenses;Èlanarine, nadoknade i slièna davanja
467;Taxes which does not depend on results and charges;Porezi koji ne ovise o dobitku i pristojbe
468;Cost of usage rights (excluding leases) and expenses of board members;Troškovi prava korištenja (osim najmova)
469;Other operating costs- intangible;Ostali troškovi poslovanja - nematerijalni
47;FINANCIAL EXPENSES;FINANCIJSKI RASHODI
470;Interest expense from Group companies ;Kamate s poduzetnicima unutar grupe
471;Foreign exchange difference and other expenses in a Group ;Teèajne razlike i drugi rashodi s poduzetnicima unutar grupe
472;Other costs from a Group companies;Ostali troškovi s poduzetnicima unutar grupe
473;Interest expense from operations with third party;Kamate iz odnosa s nepovezanim poduzetnicima
474;Penalty interest;Zatezne kamate
475;Exchange difference on translation of foreign operations with third party;Teèajne razlike iz odnosa s nepovezanim poduzetnicima
476;Loss from sale of investments in shares, stakes, bonds and other securities (which are sold below cost);Gubitci iz ulaganja u dionice, udjele, obveznice i dr. vrijednosne papire (koji su prodani ispod troška nabave - èl. 10. ZoPD)
477;Cost of discounts given;Troškovi diskonta i nagodbi
478;Unrealized loss (expense) from financial assets;Nerealizirani gubitci (rashodi) od financ. imovine
479;Other financial expenses;Ostali financijski troškovi
48;OTHER EXPENSES;OSTALI POSLOVNI RASHODI
480;Additional rebates , discounts, claims and costs of samples;Trošak naknadnih popusta, sniženja, reklamacija i troškovi uzoraka
481;Bed debts and other assets write off;Otpisi vrijednosno neusklaðenih potraživanja
482;Disposals of property, plant and equipment and intangible assets;Rashodi - otpisi nematerijalne i materijalne imovine
483;Inventory shortages and burglary costs;Manjkovi i provalne kraðe na zalihama i drugim sredstvima
484;Penalties, compensation for damages occurred and contract related costs;Kazne, penali, nadoknade šteta i troškovi iz ugovora
485;Additionally found operating expenses;Naknadno utvrðeni troškovi poslovanja
486;Gifts/donations up to 2% of total income;Darovanje do 2% od ukupnog prihoda
487;Gifts/donations above 2% of total income and other donations;Darovanja iznad 2% od UP i dr. darovanja
488;Expenses from other activities;Troškovi iz drugih aktivnosti (izvan osnovne djelatnosti)
489;Other costs-expenses;Ostali troškovi - rashodi
49;ALLOCATION OF COSTS;RASPORED TROŠKOVA
490;Allocation of costs to cost of conversion (cost of production) - (on acc. 60, 62, 63);Raspored troškova za obraèun proizvoda i usluga (prema HSFI 10 i MRS-u 2 i MRS-u 11) - uskladištivi troškovi (na raèune 60, 62 i 63)
491;Allocation of management and administrative overheads to expenses for the year - (on acc. 72);Raspored troškova za pokriæe upravnih, administrativnih, prodajnih i drugih troškova (na raèune 70 i 71)
6;WORK IN PROGRESS, BIOLOGICAL ASSETS, FINISHED GOODS, MERCHANDISE GOODS AND NON-CURRENT ASSETS HELD FOR SALE;PROIZVODNJA, BIOLOŠKA IMOVINA, GOTOVI PROIZVODI, ROBA I DUGOTRAJNA IMOVINA NAMIJENJENA PRODAJI
60;WORK IN PROGRESS - CONVERSION COSTS;PROIZVODNJA - TROŠKOVI KONVERZIJE
600;Work in progress (allocation by cost driver, cost centres, working orders);Proizvodnja u tijeku (razrada po serijama, nositeljima troškova, mjestima, pogonima, gradilištima, objektima, radnim nalozima i sl.)
601;Work in progress for services;Vrijednost usluga (u tijeku ili nedovršenih na datum bilance - MRS 2, t. 16.)
602;Production in cooperation;Vanjska proizvodnja (kooperacija i dr.)
605;Production process in free trade zone;Proizvodnja u slobodnoj zoni
606;Production in processing and manipulation phases;Proizvodnja u doradi i manipulaciji
607;Suspended production;Obustavljena proizvodnja
608;Work in progress under partnership agreement;Proizvodnja u tijeku iz ortaèkog ugovora
609;Value adjustments of work in progress;Vrijednosno usklaðivanje proizvodnje - usluga
61;UNFINISHED GOODS AND SEMI-MANUFACTURE GOODS;NEDOVRŠENI PROIZVODI I POLUPROIZVODI
610;Semi-manufacture goods on stock (analytics by the production stage);Zalihe poluproizvoda (analitika prema osnovnim skupinama ili po stupnju dovršenosti)
611;Unfinished goods and semi-manufacture goods (analytics by products types);Nedovršeni proizvodi i poluproizvodi (analitika po vrstama proizvoda)
619;Value adjustment of unfinished goods and semi-manufacture goods;Vrijednosno usklaðivanje nedovršenih proizvoda i poluproizvoda
62;BIOLOGICAL ASSETS;BIOLOŠKA IMOVINA
620;Biological assets in progress;Zalihe biološke proizvodnje u toku
621;Biological assets for sale;Zaliha biološke imovine za prodaju
629;Value adjustment of biological assets;Vrijednosno usklaðivanje biološke imovine
63;FINISHED GOODS;ZALIHE GOTOVIH PROIZVODA
630;Finished goods in warehouse;Gotovi proizvodi na skladištu (razrada za svako skladište a unutar toga po skupinama, tipovima, vrstama i sl. te poljoprivredni gotovi proizvodi)
631;Finished goods in public warehouse;Gotovi proizvodi u javnom skladištu, silosu, i dr.
632;Finished goods given in commission sale;Gotovi proizvodi dani u komisijsku prodaju
633;Finished goods given in consignment sale;Gotovi proizvodi dani u konsignacijsku prodaju
634;Finished goods in processing, finishing and manipulation phases;Gotovi proizvodi u doradi, obradi i manipulaciji
635;Finished goods in free-trade zone;Gotovi proizvodi u slobodnoj zoni
636;Obsolete and slow moving inventory;Zalihe nekurentnih proizvoda i otpadaka
637;Finished goods in storefront;Gotovi proizvodi u izložbenim prostorima
638;Finished goods from partnership agreement;Gotovi proizvodi iz ortaštava
639;Value adjustment of finished goods;Vrijednosno usklaðivanje zaliha gotovih proizvoda
64;FINISHED GOODS IN OWN STORES;GOTOVI PROIZVODI U VLASTITIM PRODAVAONICAMA
640;Finished goods in own stores;Gotovi proizvodi u prodaji u vlastitim prodavaonicama (analitika po prodavaonicama)
641;VAT included in value of goods;Uraèunani PDV u vrijednosti proizvoda
648;Margin included in sale price of finished goods;Uraèunana marža u prodajnoj cijeni gotovih proizvoda
649;Value adjustment of finished goods in own stores;Vrijednosno usklaðivanje gotovih proizvoda u prodavaonicama
65;TOTAL COST OF MERCHANDISE GOODS - TOTAL PURCHASING COST;OBRAÈUN TROŠKOVA NABAVE ROBE - TROŠKOVI KUPNJE
650;Payables purchase price;Kupovna cijena robe od dobavljaèa
651;Other dependant costs in relation with bringing merchandise goods on stock;Ostali troškovi nabave u svezi s dovoðenjem robe na zalihu
652;Duties and other import duties;Carina i druge uvozne pristojbe za robu
653;Excise duties and other taxes (analitics);Posebni porezi i trošarine (analitika)
659;Total cost of purchasing;Obraèun nabave - trošak kupnje
66;MERCHANDISE GOODS;ROBA
660;Merchandise goods on stock;Roba u skladištu
661;Merchandise goods in others warehouse and in storefront;Roba u tuðem skladištu i izlozima
662;Merchandise goods given in commission and consignment sale;Roba dana u komisijsku ili konsignacijsku prodaju
663;Merchandise goods in stores;Roba u prodavaonicama
664;Tax included in value of merchandise goods;Uraèunani porezi u robi
665;Merchadise goods placed in tax-free warehouse or in free-trade area;Roba u poreznom skladištu ili u slobodnoj zoni
666;Finished goods in processing, finishing and manipulation phases;Roba u doradi, obradi i manipulaciji
667;Merchandise goods in transit;Roba na putu
668;Margin included in sale price of merchandise goods;Uraèunana razlika u cijeni robe
669;Value adjustment of merchandise goods;Vrijednosno usklaðivanje zaliha robe
67;ADVANCE PAYMENTS FOR MERCHANDISE GOODS;PREDUJMOVI ZA NABAVU ROBE
670;Advance payments for merchandise goods;Dani predujmovi za nabavu robe
671;Advance payments for merchandise goods import;Dani predujmovi uvozniku za nabavu robe
672;Advance payments to related party for merchandise goods;Dani predujmovi za robu povezanom društvu
673;Advances for biological asset purchases;Dani predujmovi za nabavu bioloških proizvoda
679;Value adjustment of advance payments for merchandise goods;Vrijednosno usklaðenje danih predujmova za robu
68;PROPERTIES AND ARTS HELD FOR SALE;NEKRETNINE I UMJETNINE za trgovanje
680;Property which is classified as held for sale- at cost;Nabavna vrijednost nekretnina za preprodaju (s porezom na promet)
681;Additions on the property held for sale;Troškovi dodatnog ureðenja - dorade
682;Arts held for sale;Umjetnine u prodaji
683;Property which is classified as held for sale;Nekretnine za prodaju (ureðene)
684;Oldtimers for trading;Oldtimeri za trgovanje
685;VAT included in arts and oldtimers;Uraèunani PDV u umjetninama i oldtimerima
687;Advance payments for the purchase of property held for sale;Predujmovi za kupnju nekretnina i sl radi daljnje prodaje
688;Margin included in the sale price of property and arts held for sale;Uraèunana razlika u cijeni nekretnina i umjetnina za daljnju prodaju
689;Margin included in the sale price of property and arts held for sale;Vrijednosno usklaðivanje nekretnina i umjetnina i sl u prometu i predujmova
69;NON-CURRENT ASSETS HELD FOR SALE;DUGOTRAJNA IMOVINA NAMIJENJENA PRODAJI
690;Intangible assets held for sale;Nematerijalna imovina namijenjena prodaji
691;Other property, plant and equipment held for sale;Materijalna imovina namijenjena za prodaju
699;Impairment of property, plant and equipment held for sale;Vrijednosno usklaðenje dugotrajne imovine namijenjena prodaji
7;EXPENSES AND INCOME FOR THE YEAR;POKRIÆE RASHODA I PRIHODI RAZDOBLJA
70;COST OF FINISHED GOODS SOLD AND COST OF SERVICES;TROŠKOVI PRODANIH ZALIHA PROIZVODA I USLUGA
700;Cost of goods sold;Trošak zaliha prodanih proizvoda (60, 62, 63 i 64)
701;Costs of rendering services;Troškovi realiziranih usluga (490 i 601)
702;Costs of unused capacity;Troškovi neiskorištenog kapaciteta (HSFI t. 10.18. i MRS 2 t. 13)
703;Cost of sale of material and obsolete inventory;Troškovi zaliha materijala i otpadaka (31, 32, 35 i 36)
704;Value adjustment of inventory;Rashodi zaliha proizvodnje (HSFI 10 i MRS 2)
705;Expenses which relates to previous periods- by mistake not show in previous periods;Greškom neiskazani rashodi proteklih razdoblja
706;Construction contracts losses;Gubitci iz ugovora o izgradnji (MRS 11, t. 36.)
707;Costs in relation with partnership agreement;Troškovi iz ugovora o ortaštvu
708;Cost of value adjustments of work in progress, semi-finished goods and finished goods;Troškovi vrijednosnog usklaðenja proizvodnje u tijeku (609), poluproizvoda (629) i zaliha gotovih proizvoda (639 i 649)
71;COST OF GOODS SOLD;TROŠKOVI PRODANE ROBE
710;Costs of goods sold;Nabavna vrijednost prodane robe
711;Cost of property which is classified as held for sale;Nabavna vrijednost prodanih nekretnina i umjetnina
712;Costs which relates to property, plant and equipment held for sale;Troškovi dugotr. imov. namijenjeni prodaji (neto)
713;Costs of goods shortages ( due to evaporate), damages , breakage and goods write-off;Troškovi kala, rastepa, kvara i loma na robi i otpisi robe
714;Costs of replacement of goods within the warranty period;Troškovi zamjene robe u jamstvenom roku
715;Cost of good sold which relates to previous periods- by mistake not show in previous periods;Greškom neiskazani rashodi prodane robe u proteklim razdobljima u trgovini
718;Costs of value adjustments of merchandise goods and advance payments;Troškovi vrijednosnog usklaðenja trgovaèke robe i predujmova (669, 679, 689)
719;Impairment losses recognized on property, plant and equipment held for sale;Troškovi vrijednosnog usklaðenja dugotrajne imovine namijenjene prodaji (699)
72;MANAGEMENT AND ADMINISTRATIVE OVERHEADS;TROŠKOVI UPRAVE, ADMINISTRACIJE I OSTALI RASHODI
720;Cost of management, selling costs and administrative overheads;Troškovi uprave, prodaje, administracije (491)
721;Other operational expenses;Ostali poslovni rashodi - nespomenuti
73;OTHER EXPENSES ;OSTALI POSLOVNI RASHODI
730;Loss on sale of property, plant and equipment (HSFI 8 t. 8.35.);Rashodi od prodaje dugotrajne imovine (HSFI 8 t. 8.35.)
731;Expenses based on material and unespected asset diposals ;Otpisi od otuðenja imovine koji su nastali neoèekivano i u visokoj vrijednosti (HSFI 4 t. 4.7. i MRS 10, t. 9.)
732;Losses due to dispossession or natural disasters on material assets;Gubitci zbog izvlaštenja ili zbog prirodnih katastrofa na važnom dijelu imovine
733;Expenses based on material and unespected events;Rashodi iz ostalih rijetkih i neobiènih dogaðaja ili transakcija
734;Other expenses due to penalties, paid compensations and liabilities from subsequent events;Izvanredne kazne, penali, odštete, naknadno utvrð. obveze i sl.
735;Unrealised losses;Nerealizirani gubitci
736;The costs of goods sold in previous years (returned in this year);Troškovi vraæene robe prodane u prethodnim god.
737;Losses from biological assets arising from valuation;Gubitci od procjene biološke imovine
738;Losses from agricultural assets arising from valuation;Gubitci od procjene poljoprivrednih proizvoda
74;SHARE IN PROFIT/LOSS OF A GROUP AND IN ASSOCIATED UNDERTAKING;UDIO U DOBITKU I GUBITKU DRUŠTAVA POVEZANIH SUDJELUJUÆIM INTERESOM I OD ZAJEDNIÈKIH POTHVATA
740;Share in loss in a Group and in associated undertaking;Udio u dobitku društava povezanih sudjelujuæim interesom i od zajednièkih pothvata
745;Share in profit in a Group and in associated undertaking;Udio u gubitku od društava povezanih sudjelujuæim interesom i od zajednièkih pothvata
75;REVENUE FROM SALE OF GOODS AND RENDERING OF SERVICES;PRIHODI OD PRODAJE PROIZVODA I USLUGA
750;Sale of goods (analytics by goods or profit centres);Prihodi od prodaje proizvoda (analitika po proizvodima ili profitnim centrima)
751;Revenue from the rendering of services;Prihodi od prodaje usluga
752;Revenue from the rendering of construction services- construction services agreement;Prihodi od graditeljskih usluga - iz ugovora o izgradnji (graðevina)
753;Sales incom from goods- foreign;Prihodi od prodaje dobara u inozemstvo
754;Sales incom from services - foreign;Prihodi od prodaje usluga u inozemstvo
755;Sale income from internal usage of own goods and services ;Prihodi s osnove upotrebe proizvoda i usluga za vlastite potrebe
756;Revenue from leases and rents;Prihodi od zakupa i najmova
757;Revenues form partnership agreement;Prihodi iz ortaštva
758;Other income from other sale;Ostali prihodi od ostale prodaje
759;Sale income from Group companies;Prihodi od prodaje proizvoda i usluga poduzetnicima unutar grupe
76;REVENUE FROM SALE OF MERCHANDISE GOODS;PRIHODI OD PRODAJE TRGOVAÈKE ROBE
760;Revenue from sale of goods;Prihodi od prodaje robe
761;Sales incom from goods- foreign;Prihodi od prodaje robe u inozemstvu
762;Revenue from the rendering of merchandise services;Prihodi od trgovaèkih usluga
763;Income from sale of slow-moving inventory;Prihodi od prodaje nekurentne robe (robe u kvaru, ošteæenju, demodirana i sl.)
764;Income from sale of goods on commodity loan granted;Prihodi od prodaje robe na robni kredit
765;Sale income from internal usage of own merchandise goods ;Prihodi s osnove upotrebe robe za vlastite potrebe
766;Income from sale of goods on financial leasing;Prihodi od prodane robe u financijski lizing (najam)
767;Income from sale of property, plan and equipment and arts (held for sale);Prihodi od preprodaje nekretnina i umjetnina
768;Other income from sale of goods and rendering of merchandise services;Ostali prihodi od prodaje roba i trgovaèkih usluga
769;Sale income from Group companies;Prihodi od prodaje trgovaèke robe poduzetnicima unutar grupe
77;FINANCIAL INCOME;FINANCIJSKI PRIHODI
770;Dividends income, interest income, foreign exchange difference and other financial income from a Group transactions;Prihodi od ulaganja u udjele (dionice) i ostala financijska ulaganja poduzetnika unutar grupe, prihodi od kamata, teèajnih razlika i ostali financijski prihodi s poduzetnicima unutar grupe
771;Interest income;Prihodi od kamata
772;Income from exchange difference on translation of foreign operations and other income;Prihodi od teèajnih razlika i ostali prihodi
773;Income from dividends and share in result;Prihodi od dividende i dobitaka iz udjela
774;Financial income  from long term financial asset and loans given;Prihodi od ostalih dugotrajnih financijskih ulaganja i zajmova
775;Dividends income from associated undertakings ;Prihodi od ulaganja u udjele (dionice) društava povezanih sudjelujuæim interesom
776;Unrealized gains from financial assets;Nerealizirani dobitci (prihodi) od financijske imovine
777;Income from negative goodwill;Prihodi negativnog goodwilla
778;Financial fees income;Prihodi od financijskih naknada
779;Other financial income;Ostali financijski prihodi
78;OTHER OPERATIONAL INCOME;OSTALI POSLOVNI PRIHODI
780;Income from liability write off and from discounts received;Prihodi od otpisa obveza i popusta
781;Net gain on disposal of assets, surpluses and evaluation;Prihodi od rezidualnih imovinskih stavki, viškova i procjena
782;Income from reversal of value adjustment and provisions and collected receivables written off;Prihodi od ukidanja rezerviranja i naknadno naplaæeni prihodi
783;Income from grants, subsidies and compensations;Prihodi od refundacije, dotacija, subvencija i nadoknada
784;Income from losses and revaluations reversals;Prihodi od ukidanja gubitaka i revalorizacija
785;Other operational income;Ostali poslovni prihodi
786;Income from government grants;Prihodi od državnih potpora (HSFI 15 i MRS 20)
787;Gains from biological assets arising from valuation;Dobitci od procjene poljoprivrednih proizvoda i biološke imovine (HSFI 17, t. 17.12 i MRS 41)
788;Revenues from the sale of a significant part of the assets;Prihodi od prodaje znaèajnog dijela imovine (društva, pogona, gosp. cjeline)
789;Other income (free deliverables, non-operational income);Ostali prihodi (npr. veliki besplatni primitak, prihod koji nije proizašao iz redovitog poslovanja)
79;DIFFERENCE BETWEEN INCOME AND EXPENSES;RAZLIKA PRIHODA I RASHODA FINANCIJSKE GODINE
790;Difference between income and expenses;Razlika prihoda i rashoda (iz cjelokupnog poslovanja)
8;FINANCIAL RESULT;FINANCIJSKI REZULTAT POSLOVANJA
80;PROFIT OR LOSS FOR THE YEAR;DOBITAK ILI GUBITAK razdoblja
800;Profit before tax;Dobitak prije oporezivanja
801;Loss before tax;Gubitak prije oporezivanja
803;Income tax expense;Porez na dobitak (gubitak)
804;Profit or loss for the year;Dobitak ili gubitak razdoblja
81;PROFIT OR LOSS  FROM DISCONTINUED OPERATIONS (APPLICABLE FOR COMPANIES WHICH USE MSFI AND HAVE DISCONTINUED OPERATIONS) ;DOBITAK ILI GUBITAK PREKINUTOG POSLOVANJA PRIJE OPOREZIVANJA (KORISTI SAMO PODUZETNIK OBVEZNIK PRIMJENE MSFI-ja KOJI IMA PREKINUTO POSLOVANJE)
810;Profit before tax from discontinued operations;Dobitak prekinutog poslovanja prije oporezivanja
811;Loss before tax from discontinued operations;Gubitak prekinutog poslovanja prije oporezivanja
812;Income tax expense from discontinued operations;Porez na dobitak (gubitak) prekinutog poslovanja
813;Profit or loss for the year from discontinued operations;Dobit ili gubitak prekinutog poslovanja
82;TOTAL PROFIT OR LOSS FOR THE YEAR  (APPLICABLE FOR COMPANIES WHICH USE MSFI AND HAVE DISCONTINUED OPERATIONS) ;DOBIT ILI GUBITAK UKUPNOG POSLOVANJA PRIJE OPOREZIVANJA (KORISTI SAMO PODUZETNIK OBVEZNIK PRIMJENE MSFI-A KOJI IMA PREKINUTO POSLOVANJE)
820;Profit before tax;Dobitak prije oporezivanja
821;Loss before tax;Gubitak prije oporezivanja
822;Income tax expense;Porez na dobitak (gubitak)
823;Profit or loss for the year;Dobitak ili gubitak razdoblja
83;PROFIT OR LOSS FOR THE YEAR  ATTRIBUTEBLE TO OTHERS ;DOBITAK ILI GUBITAK RAZDOBLJA KOJI PRIPADA DRUGIMA
830;Profit for the year attributable to ordinary equity holders of the parent;Dobitak pripisan imateljima kapitala matice
831;Loss for the year attributable to ordinary equity holders of the parent;Gubitak koji tereti imatelje kapitala matice
832;Profit for the year attributable to non- controlling interests;Dobitak pripisan manjinskom interesu
833;Loss for the year attributable to non- controlling interests;Gubitak koji tereti manjinski interes
9;EQUITY AND RESERVES AND OF THE BALANCE SHEET ITEMS;KAPITAL I PRIÈUVE TE IZVANBILANÈNI ZAPISI
90;SHARE CAPITAL;TEMELJNI - (UPISANI) KAPITAL
900;Issued capital - paid in;Upisani temeljni kapital koji je plaæen
901;Issued capital - non controlling interests;Upisani temeljni kapital manjinskih èlanova
902;Issued capital- not paid in;Upisani kapital koji nije plaæen
903;Shareholders share in public limited company capital;Kapital (ulozi) èlanova javnog trgovaèkog društva
904;Partners business stakes in limited partnership;Kapital (ulozi) komanditora komanditnog društva
905;Government capital in company;Državni kapital u udjelima
906;Members business stake in cooperative capital;Kapital èlanova zadruge
91;CAPITAL RESERVES;KAPITALNE PRIÈUVE
910;Paid in stake/share above issued share capital;Uplaæeni udjeli - dionice iznad svote temeljnog kapitala
911;Capital reserves from additional payments in order to gain special rights in the Company (convertible bonds);Kapitalne prièuve iz dodatnih uplata radi stjecanja posebnih prava u društvu (ili zamjenjivih obveznica)
912;Capital reserves from the additional payments of equity holders;Kapitalne prièuve iz uplata dodatnih èinidbi
913;Decrease of share capital transferred to capital reserve;Kapitalne prièuve iz ostatka pri smanjenju temeljnog kapitala
914;Capital reserves from other sources;Kapitalne prièuve iz drugih izvora
915;Capital gain from sale of treasury shares - stakes;Kapitalni dobitak iz prodaje vlastitih udjela - dionica
916;Capital gains on the sale of shares issued;Kapitalni dobitak na prodane emitirane dionice
917;Investments in silent company transferred to capital reserves;Kapitalne prièuve iz ulaganja tajnog èlana društva (èl. 148. ZTD-a)
918;Capital loss from sale of treasury shares - stakes;Kapitalni gubitci iz vlastitih dionica i udjela
919;Investments of entrepreneur transferred to capital reserves;Kapital iz ulaganja obrtnika dobitaša
92;RESERVES FROM RETAINED EARNINGS;PRIÈUVE IZ DOBITKA
920;Legal reserves;Zakonske prièuve
921;Reserves for treasury shares;Prièuve za vlastite dionice i udjele (èl. 233. i 406.a ZTD-a)
